variant_id	variant_civic_url	gene	entrez_id	variant	summary	variant_groups	chromosome	start	stop	reference_bases	variant_bases	representative_transcript	ensembl_version	reference_build	chromosome2	start2	stop2	representative_transcript2	variant_types	hgvs_expressions	last_review_date	civic_variant_evidence_score	allele_registry_id	clinvar_ids	variant_aliases	assertion_ids	assertion_civic_urls	is_flagged
1	https://civicdb.org/links/variants/1	ABL1	25	BCR::ABL	The BCR-ABL fusion protein, commonly referred to as the Philadelphia chromosome, is one of the most studied fusion genes in cancer. It has widely been considered the initiating event in chronic myelogenous leukemia (CML). However, despite its ability to initiate disease in mice, its status as an initiating mutation is in dispute. In what is commonly used as the poster-child for targeted therapeutics, the development and use of imatinib in the clinic has led to profound improvements in the prognosis of the disease. However, imatinib resistance is still seen in patients with mutations in the ABL kinase domain of the fusion, most notably the T315I variant. In patients resistant to imatinib, either acquired or otherwise, second generation BCR-ABL TKI's (dasatinib and nilotinib) have seen some success in delivering a tumor response. Third generation ABL1 inhibitor ponatinib is the only FDA approved drug with activity against T315I . However due to risk of life-threatening blood clots and severe narrowing of blood vessels ponatinib is ONLY approved for T315I-positive CML or T315I-positive Ph+ ALL or in cases of CML, Ph+ ALL with resistance or intolerance to other approved ABL1 inhibitors.	ABL1 fusions in B-ALL	22	23522397	23632600			ENST00000305877.8	75	GRCh37	9	133729451	133763063	ENST00000318560.5	transcript_fusion	N/A	2022-03-10 22:27:25 UTC	255.5		N/A	T(9;22)(Q34;Q11),BCR-ABL1,BCR-ABL			false
2	https://civicdb.org/links/variants/2	ABL1	25	BCR::ABL T315I	While the efficacy of imatinib has revolutionized chronic myelogenous leukemia (CML) treatment, it is still not a cure-all. Both initial resistance and acquired resistance as a result of selection have been seen in a small subset of CML patients. The ABL kinase domain mutation T315I (aka T334I) has been shown to be one such mutation that confers resistance to imatinib. Second generation TKI's (dasatinib and ponatinib) specific to BCR-ABL have shown efficacy in treating resistant cases.	Imatinib Resistance	9	133748283	133748283	C	T	ENST00000318560.5	75	GRCh37					missense_variant,transcript_fusion	NM_007313.2:c.1001C>T,NP_005148.2:p.Thr315Ile,ENST00000372348.2:c.1001C>T,NC_000009.11:g.133748283C>T	2022-03-10 19:55:19 UTC	146.0	CA122575	12624	THR334ILE,RS121913459,BCR-ABL THR315ILE,BCR-ABL1 T315I,BCR-ABL1 THR315ILE,BCR-ABL T315I			false
3	https://civicdb.org/links/variants/3	ABL1	25	BCR::ABL E255K	While the efficacy of imatinib has revolutionized chronic myelogenous leukemia (CML) treatment, it is still not a cure-all. Both initial resistance and acquired resistance as a result of selection have been seen in a small subset of CML patients. The ABL kinase domain mutation E255K has been shown to be one such mutation that confers resistance to imatinib. Second generation TKI's (dasatinib and nilotinib) specific to BCR-ABL have shown efficacy in treating resistant cases.	Imatinib Resistance	9	133738363	133738363	G	A	ENST00000318560.5	75	GRCh37					missense_variant,transcript_fusion	NC_000009.11:g.133738363G>A,NM_005157.5:c.763G>A,NP_005148.2:p.Glu255Lys,ENST00000318560.5:c.763G>A	2022-03-11 04:36:22 UTC	83.0	CA16602551	376090	E274K,RS121913448,BCR-ABL GLU255LYS,BCR-ABL1 E255K,BCR-ABL1 GLU255LYS,BCR-ABL E255K			false
4	https://civicdb.org/links/variants/4	AKT1	207	E17K	AKT1 E17K is a recurrent mutation that has been observed in breast, colorectal, lung, and ovarian cancer. It has been convincingly shown to be an activating mutation resulting in PI3K/AKT/mTOR pathway activity. It has been suggested that this mutation decreases the cell's sensitivity to AKT1 allosteric kinase inhibitors. This, and other AKT1 mutations, are the subject of much research and development for therapeutics.		14	105246551	105246551	C	T	ENST00000407796.2	75	GRCh37					missense_variant	NC_000014.8:g.105246551C>T,NM_001014432.1:c.49G>A,NP_001014432.1:p.Glu17Lys,ENST00000407796.2:c.49G>A	2021-11-12 18:53:34 UTC	33.5	CA123660	13983	GLU17LYS,RS34409589			false
5	https://civicdb.org/links/variants/5	ALK	238	EML4::ALK	The EML4-ALK fusion variant 1 consisting of ALK kinase domain (exons 20-29) fused to EML4 exons 1-13 is the most common EML4-ALK variant, and was discovered in non-small cell lung cancer. Multiple EML4 breakpoint shave been described with differential sensitivity to inhibitors with variant 1 showing greater sensitivity than 3a in cell lines. EML4-ALK is crizotinib sensitive; however, several mutations that confer resistance mutations have been described in case studies. In the only clinical trial for crizotinib that included determination of EML4-ALK variant type in a subset of its participants, a very high response rate was observed, although the numbers were insufficient to validate correlation of variant type to outcome. Preclinical studies with this variant have indicated sensitivity to Hsp90 inhibitors.	ALK Fusions	2	42396490	42522656			ENST00000318522.5	75	GRCh37	2	29415640	29446394	ENST00000389048.3	transcript_fusion		2022-03-10 21:08:52 UTC	38.0		N/A	EML4-ALK			false
6	https://civicdb.org/links/variants/6	ALK	238	EML4::ALK C1156Y	In patients with non-small cell lung cancer exhibiting EML4-ALK fusion, C1156Y has been shown to confer resistance to crizotinib. Case reports indicate that secondary mutations can modulate drug sensitivity. EML4-ALK C1156Y/L1196M maintained crizotinib resistance while the lorlatinib resistant combination EML4-ALK C1156Y/L1198F re-sensitized the tumor to crizotinib treatment.	Crizotinib Resistance,ALK Fusions	2	29445258	29445258	C	T	ENST00000389048.3	75	GRCh37					missense_variant,transcript_fusion	ENST00000389048.3:c.3467G>A,NC_000002.11:g.29445258C>T,NM_004304.4:c.3467G>A,NP_004295.2:p.Cys1156Tyr	2022-03-11 04:10:20 UTC	29.0	CA16602783	376340	EML4-ALK CYS1156TYR,RS1057519859,EML4-ALK C1156Y			false
7	https://civicdb.org/links/variants/7	ALK	238	EML4::ALK L1196M	In patients with non-small cell lung cancer exhibiting EML4-ALK fusion, L1196M has been shown to confer resistance to crizotinib. This was also true in a patient with both EML4-ALK C1156Y & L1196M.	Crizotinib Resistance,ALK Fusions	2	29443631	29443631	G	T	ENST00000389048.3	75	GRCh37					missense_variant,transcript_fusion	ENST00000389048.3:c.3586C>A,NC_000002.11:g.29443631G>T,NM_004304.4:c.3586C>A,NP_004295.2:p.Leu1196Met	2022-03-11 04:05:01 UTC	21.0	CA16602593	376135	EML4-ALK LEU1196MET,RS1057519784,EML4-ALK L1196M			false
8	https://civicdb.org/links/variants/8	ALK	238	F1174L	ALK F1174L has been observed as recurrent in neuroblastoma, non-small cell lung cancer (NSCLC), and other cancer types. Neuroblastoma cells containing this mutation have shown resistance to low doses of criztonib. However, increased dosage can overcome this resistance in cell lines studies. TAE684 has also proven effective in both NSCLC and neuroblastoma F1174L containing cells.	Crizotinib Resistance	2	29443695	29443695	G	T	ENST00000389048.3	75	GRCh37					missense_variant	NM_004304.4:c.3522C>A,NP_004295.2:p.Phe1174Leu,NC_000002.11:g.29443695G>T,ENST00000389048.3:c.3522C>A	2018-11-30 14:45:01 UTC	33.5	CA279586	217851	PHE1174LEU,RS863225281			false
9	https://civicdb.org/links/variants/9	ALK	238	R1275Q	ALK R1275Q has been observed as a recurrent mutation in  neuroblastoma, non-small cell lung cancer (NSCLC), as well as other cancer types. Neuroblastoma cells with this mutation have shown sensitivity to the ALK-inhibitor TAE684. This and the geldanamycin deriviative 17-DMAG have been shown to be effective in NSCLC cell lines.		2	29432664	29432664	C	T	ENST00000389048.3	75	GRCh37					missense_variant	NM_004304.4:c.3824G>A,NP_004295.2:p.Arg1275Gln,NC_000002.11:g.29432664C>T,ENST00000389048.3:c.3824G>A	2018-11-30 14:44:59 UTC	23.0	CA341482	18083	ARG1275GLN,RS113994087			false
10	https://civicdb.org/links/variants/10	ARAF	369	S214C	ARAF S214C has been found to be a recurrent oncogenic mutation in non-small cell lung cancer. It has been shown to confer sensitivity to sorafenib and trametenib in cell lines. In a case study of advanced stage lung adenocarcinoma harboring this mutation, sorafenib also acheived near-complete clinical remission. This case has brought more interest to the variant from a research and clinical perspective.		X	47426121	47426121	C	G	ENST00000377045.4	75	GRCh37					missense_variant	NC_000023.10:g.47426121C>G,NM_001654.4:c.641C>G,NP_001645.1:p.Ser214Cys,ENST00000377045.4:c.641C>G	2018-11-30 14:43:04 UTC	11.0	CA16602595	376137	SER214CYS,RS1057519786			false
11	https://civicdb.org/links/variants/11	BRAF	673	V600D	Patients harboring mutations in valine 600 residue of BRAF have been shown to be sensitive to dabrafenib. For more information on the V600 locus, see the V600E entry.	Other V600's	7	140453135	140453136	CA	AT	ENST00000288602.6	75	GRCh37					missense_variant	NC_000007.13:g.140453135_140453136delinsAT,NM_004333.4:c.1799_1800delTGinsAT,NP_004324.2:p.Val600Asp,ENST00000288602.6:c.1799_1800delTGinsAT	2020-11-21 22:43:17 UTC	47.0	CA16602419	375939	RS121913377,VAL600ASP			false
12	https://civicdb.org/links/variants/12	BRAF	673	V600E	BRAF V600E has been shown to be recurrent in many cancer types. It is one of the most widely studied variants in cancer. This variant is correlated with poor prognosis in certain cancer types, including colorectal cancer and papillary thyroid cancer. The targeted therapeutic dabrafenib has been shown to be effective in clinical trials with an array of BRAF mutations and cancer types. Dabrafenib has also shown to be effective when combined with the MEK inhibitor trametinib in colorectal cancer and melanoma. However, in patients with TP53, CDKN2A and KRAS mutations, dabrafenib resistance has been reported. Ipilimumab, regorafenib, vemurafenib, and a number of combination therapies have been successful in treating V600E mutations. However, cetuximab and panitumumab have been largely shown to be ineffective without supplementary treatment.		7	140453136	140453136	A	T	ENST00000288602.6	75	GRCh37					missense_variant	NM_004333.4:c.1799T>A,NP_004324.2:p.Val600Glu,NC_000007.13:g.140453136A>T,ENST00000288602.6:c.1799T>A	2022-04-01 23:37:24 UTC	1353.5	CA123643	13961,376069	RS113488022,VAL600GLU,V640E,VAL640GLU	23,10,12,20,7	https://civicdb.org/links/assertions/23	https://civicdb.org/links/assertions/10	https://civicdb.org/links/assertions/12	https://civicdb.org/links/assertions/20	https://civicdb.org/links/assertions/7	false
13	https://civicdb.org/links/variants/13	BRAF	673	V600E and V600M	A case study of a single patient harboring both a V600E and a V600M mutation, dabrafenib was shown to acheive clinical response.	Other V600's	7	140453135	140453137			ENST00000288602.6	75	GRCh37					missense_variant		2021-04-14 05:00:56 UTC	2.5		13961,44815				false
14	https://civicdb.org/links/variants/14	BRAF	673	V600E and Amplification	Amplification of BRAF V600E has been shown to confer resistance to MEK inhibitors. For more information on the V600 locus, see the V600E entry.		7	140434279	140624564			ENST00000288602.6	75	GRCh37					missense_variant,transcript_amplification		2021-04-06 21:13:05 UTC	1.0						false
17	https://civicdb.org/links/variants/17	BRAF	673	V600	BRAF mutations of the valine 600 residue have been shown to be recurrent in many cancer types. Of the V600 mutations, V600E is the most widely researched. V600 mutations as a whole have been correlated to poorer prognosis in colorectal and papilarry thyroid cancers. V600 mutations have also been shown to confer sensitivity to the BRAF inhibitor dabrafenib. For a more detailed summary, click the individual mutations.	Other V600's	7	140453136	140453137			ENST00000288602.6	75	GRCh37					protein_altering_variant		2020-12-10 20:13:06 UTC	460.0		13961,44815,376288,40389,376289,44816	VAL600			false
18	https://civicdb.org/links/variants/18	CCND1	595	Amplification	CCND1 amplification has been implicated in poorer prognosis in non-small cell lung cancer.		11	69455855	69469242			ENST00000227507.2	75	GRCh37					transcript_amplification	N/A	2021-02-26 02:15:41 UTC	47.0		N/A		2,1	https://civicdb.org/links/assertions/2	https://civicdb.org/links/assertions/1	false
19	https://civicdb.org/links/variants/19	CCND1	595	Expression	CCND1 expression, and its prognositc impact, is still in dispute. Three experiments in non-small cell lung cancer have shown it to have no impact on survival, but three additional studies have shown it results in poorer prognosis. There is also some ambiguity in how the boundaries between expression and overexpression are defined.		11	69455855	69469242			ENST00000227507.2	75	GRCh37					N/A	N/A	2021-02-26 02:15:46 UTC	30.0		N/A				false
20	https://civicdb.org/links/variants/20	CCND1	595	Overexpression	Cyclin D has been shown in many cancer types to be misregulated. Well established for their oncogenic properties, the cyclins and the cyclin-dependent kinases (CDK's) they activate have been the focus of major research and development efforts over the past decade. The methods by which the cyclins are misregulated are widely variable, and range from genomic amplification to promoter methylation changes. While Cyclin D2 has only been found to be significantly misregulated in glioma, Cyclin D1 in particular seems to be a pan-cancer actor. Cyclin D misregulation has been shown to lead to poorer outcomes in a number of studies, and currently there are no FDA-approved targeted therapies.		11	69455855	69469242			ENST00000227507.2	75	GRCh37					N/A	N/A	2021-02-26 02:15:51 UTC	116.0		N/A				false
21	https://civicdb.org/links/variants/21	CCND2	894	OVEREXPRESSION	Cyclin D has been shown in many cancer types to be misregulated. Well established for their oncogenic properties, the cyclins and the cyclin-dependent kinases (CDK's) they activate have been the focus of major research and development efforts over the past decade. The methods by which the cyclins are misregulated are widely variable, and range from genomic amplification to promoter methylation changes. While Cyclin D2 has only been found to be significantly misregulated in glioma, Cyclin D1 in particular seems to be a pan-cancer actor. Cyclin D misregulation has been shown to lead to poorer outcomes in a number of studies, and currently there are no FDA-approved targeted therapies.		12	4382938	4414516			ENST00000261254.3	75	GRCh37					N/A		2017-12-01 14:40:28 UTC	16.0		N/A				false
22	https://civicdb.org/links/variants/22	CCND2	894	PROMOTER DEMETHYLATION	Cyclin D has been shown in many cancer types to be misregulated. Well established for their oncogenic properties, the cyclins and the cyclin-dependent kinases (CDK's) they activate have been the focus of major research and development efforts over the past decade. The methods by which the cyclins are misregulated are widely variable, and range from genomic amplification to promoter methylation changes. While Cyclin D2 has only been found to be significantly misregulated in glioma, Cyclin D1 in particular seems to be a pan-cancer actor. Cyclin D misregulation has been shown to lead to poorer outcomes in a number of studies, and currently there are no FDA-approved targeted therapies.		12	4381437	4382937			ENST00000261254.3	75	GRCh37					N/A		2017-12-01 14:40:28 UTC	3.0						false
23	https://civicdb.org/links/variants/23	CCND3	896	Loss	Cyclin D has been shown in many cancer types to be misregulated. Well established for their oncogenic properties, the cyclins and the cyclin-dependent kinases (CDK's) they activate have been the focus of major research and development efforts over the past decade. The methods by which the cyclins are deregulated are widely variable, and range from genomic amplification to promoter methylation changes. Cyclin D3 loss has been reported in T-cell acute lymphoblastic leukemia (T-ALL), a seemingly unique trend when compared to the amplifcations and overexpressions of the other cyclin D's. Treating cyclin D3 knockout mice with the targeted therapeutic palbociclib significantly increased the median survival of a Notch-driven model of T-ALL.		6	41902671	41909586			ENST00000372991.4	75	GRCh37					loss_of_function_variant		2022-08-03 16:04:28 UTC	3.0		N/A		35	https://civicdb.org/links/assertions/35	false
24	https://civicdb.org/links/variants/24	CCNE1	898	Overexpression	Cyclin E, while currenly not as widely implicated as its counterpart, cyclin D, has been implicated in various carcinomas, including breast, gastric, stomach and colorectal. High levels of cyclin E, either by gene amplification or overexpression, are correlated with later stage disease and have been shown to lead to poorer prognosis in gastic carcinoma. It has also been shown, in lung cancer specifically, that neoplastic cells with higher levels of the cyclin E/CDK2 complex are more radiosensitive than their lowly expressed counterparts.		19	30302805	30315215			ENST00000262643.3	75	GRCh37					N/A		2021-04-06 21:12:17 UTC	62.0		N/A				false
25	https://civicdb.org/links/variants/25	CDK4	1019	EXPRESSION	CDK4, along with its partner CDK6, are key players in cell cycle progression. The complex has been implicated in a number of cancer types, and is the focus of therapeutic research and development. One targeted therapy for CDK inhibition is palbociclib, which may slow the growth of advanced stage breast cancers. It has also been shown, in mouse, that CDK inhibition may sensitize mutant PIK3CA tumors to PI3K inhibitors.		12	58141510	58146304			ENST00000257904.6	75	GRCh37					N/A		2017-12-01 14:40:28 UTC	8.0		N/A				false
27	https://civicdb.org/links/variants/27	CDKN2A	1029	Promoter Hypermethylation	CDKN2A loss has been shown to be a significant event in a number of cancer types. One mechanism by which this can occur is by hypermethylation of the CDKN2A promoter region. While no targeted therapeutic has been engaged in clinical trials, the prognostic impact has been studied by a number of meta-analyses. The prognostic impact of promoter hypermethylation has been relatively ambiguous. Many studies have shown significant p-values suggesting poorer prognostic outcomes for patients with hypermethylation in colorectal, liver, and younger lung cancer patients. This being said, there is still research to be done before this becomes a widely-accepted prognostic indicator.		9	21974827	21994591			ENST00000498124.1	75	GRCh37					N/A		2021-03-31 20:33:37 UTC	15.0						false
28	https://civicdb.org/links/variants/28	CEBPA	1050	N-TERMINAL FRAME SHIFT	CEBPA N-terminal frame shift mutations that result in a premature stop codon are associated with cytogenetically normal acute myeloid leukemia (CN-AML). CEBPA mutations are associated with a favorable prognosis; however, NPM1 and FLT3 mutations should also be assessed in CN-AML patients as concurrent mutations may have prognostic implications. N-terminal frame shift mutations within amino acids 1-120 have been shown to disrupt expression of the full-length 42kDa isoform while maintaining expression of a 30kDa isoform (translated from the AUG at full-length protein isoform amino acid M120). This 30kDa isoform exhibits dominant negative activity.		19	33792961	33793470			ENST00000498907.2	75	GRCh37					frameshift_truncation,dominant_negative_variant		2017-12-01 14:40:28 UTC	3.0						false
29	https://civicdb.org/links/variants/29	CEBPA	1050	Mutation	CEBPA mutations are associated with cytogenetically normal acute myeloid leukemia (CN-AML) and a favorable prognosis. However, NPM1 and FLT3 mutations should also be assessed in CN-AML patients as concurrent mutations may have prognostic implications.		19	33790840	33793470			ENST00000498907.2	75	GRCh37					transcript_variant,loss_of_function_variant		2021-02-11 00:57:12 UTC	105.0		N/A				false
30	https://civicdb.org/links/variants/30	CSF1R	1436	MEF2D::CSF1R	MEF2D-CSF1R is a fusion that has been observed in acute lymphocytic leukemia. In cell lines harboring this event, treatment with imatinib has shown notable sensitivity.		1	156446804	156470620			ENST00000348159.4	75	GRCh37	5	149433787	149441412	ENST00000286301.3	transcript_fusion		2022-03-11 17:36:28 UTC	10.5		N/A	MEF2D-CSF1R			false
31	https://civicdb.org/links/variants/31	PRKACA	5566	DNAJB1::PRKACA	This fusion has been found to be very recurrent in the rare form of adolescent liver cancer, fibrolamellar hepatocellular carcinoma. In one study, this fusion was observed in 15/15 FL-HCC cases examined and functional studies found that the fusion retained kinase activity. The presence of this fusion may be used as a diagnostic marker for this rare tumor type.		19	14628951	14629232			ENST00000254322.2	75	GRCh37	19	14202500	14218221	ENST00000308677.4	transcript_fusion		2022-04-14 15:37:22 UTC	75.0		N/A	DNAJB1-PRKACA	24	https://civicdb.org/links/assertions/24	false
32	https://civicdb.org/links/variants/32	DNMT3A	1788	R882	DNMT3A R882 mutations are associated with cytogenetically normal acute myeloid leukemia (CN-AML) with R882H as the most common form. Mutations in DNMT3A have largely been associated with poorer prognosis, however this is not consistent across all studies. This may be a result of patient age or combining R882 and non-R882 mutations during analysis as studies have indicated independent mechanisms of action and differential prognostic implications for these mutation types. One study that independently analyzed R882 and non-R882 mutations showed R882 mutations were associated with poorer prognosis than patients with wildtype and non-R882 mutations, but only in older patients with AML.		2	25457241	25457243			ENST00000264709.3	75	GRCh37					missense_variant		2021-02-24 19:52:43 UTC	510.0		375881,375880,375879,375884,375883,375882	R693,ARG882,ARG693			false
33	https://civicdb.org/links/variants/33	EGFR	1956	L858R	EGFR L858R has long been recognized as a functionally significant mutation in cancer, and is one of the most prevalent single mutations in lung cancer. Best described in non-small cell lung cancer (NSCLC), the mutation seems to confer sensitivity to first and second generation TKI's like gefitinib and neratinib. NSCLC patients with this mutation treated with TKI's show increased overall and progression-free survival, as compared to chemotherapy alone. Third generation TKI's are currently in clinical trials that specifically focus on mutant forms of EGFR, a few of which have shown efficacy in treating patients that failed to respond to earlier generation TKI therapies.		7	55259515	55259515	T	G	ENST00000275493.2	75	GRCh37					missense_variant	NC_000007.13:g.55259515T>G,NM_005228.4:c.2573T>G,ENST00000275493.2:c.2573T>G,NP_005219.2:p.Leu858Arg	2021-02-04 23:25:48 UTC	375.0	CA126713	16609,376282,376280	LEU858ARG,RS121434568	5,6	https://civicdb.org/links/assertions/5	https://civicdb.org/links/assertions/6	false
34	https://civicdb.org/links/variants/34	EGFR	1956	T790M	EGFR T790M was one of the very first mutations recognized to confer resistance to targeted therapies in non-small cell lung cancer. While successful in amplified EGFR, the efficacy of the first and second generation TKI's (erlotinib, gefitinib, neratinib) in treating patients harboring this mutation before treatment is notably lower. This lack of efficacy can likely be to blame for the poorer prognosis for patients with this mutation as compared to patients with wildtype EGFR or other types of EGFR mutations. Approximately half of EGFR mutant tumors with acquired resistance to TKI inhibition have been shown to harbor this mutation, implicating it as a mechanism of acquired therapy resistence. A third generation TKI (osimertinib) has been approved for the treatment of EGFR T790M mutant NSCLC. Patients positive for T790M in a plasma-based test have similar outcomes like those with tumor biopsy testing.	EGFR TKI Resistance	7	55249071	55249071	C	T	ENST00000275493.2	75	GRCh37					missense_variant	ENST00000275493.2:c.2369C>T,NM_005228.4:c.2369C>T,NP_005219.2:p.Thr790Met,NC_000007.13:g.55249071C>T	2020-12-16 20:31:40 UTC	386.25	CA090928	16613	THR790MET,RS121434569			false
35	https://civicdb.org/links/variants/35	ERBB2	2064	D769H	ERBB2 D769H was one of the first ERBB2 variants to be functionally classified (Bose et al. 2013). This mutation was shown to be an activating mutation in an in vitro assay. In the same paper, this mutation (along with other ERBB2 activating mutations) in MCF10A breast cancer cell lines were shown to be sensitive to the kinase inhibitor neratinib. More recent evidence may show that HER2 activating mutations confer sensitivity to a host of tyrosine kinase inhibitors, which is the topic of current clinical trials and research.	HER2 Activating	17	37880261	37880261	G	C	ENST00000269571.5	75	GRCh37					missense_variant	NM_001289937.1:c.2305G>C,NP_001276866.1:p.Asp769His,ENST00000269571.5:c.2305G>C,NC_000017.10:g.37880261G>C	2018-11-30 14:44:12 UTC	4.0	CA16602465	375991	ASP769HIS,D739H,D754H,ASP739HIS,ASP754HIS,D769H,RS121913468			false
